ID,Severity,Start_Time,End_Time,Start_Lat,Start_Lng,Distance(mi),Description,Timezone,Sunrise_Sunset
A-1616901,3,2020-01-28 08:18:11,2020-01-28 10:34:40,31.757092,-106.352554,0.0,Lane blocked due to accident on I-10 Westbound at Exits 28A 28B Gateway Blvd.,US/Mountain,Day
A-661483,3,2022-04-05 04:31:01,2022-04-05 05:00:04,32.826199,-96.872307,0.0,Two left lane blocked and left hand shoulder blocked due to crash on I-35E Southbound at Exit 434A.,US/Central,Night
A-6536246,2,2021-01-18 04:18:52,2021-01-18 06:08:47,32.742866,-96.753416,0.013,Incident on BEXAR ST near DORRIS ST Expect long delays.,US/Central,Night
A-1073482,3,2021-04-22 18:17:16,2021-04-22 19:00:47,29.78476,-95.601776,0.0,Right and center lane blocked due to accident on I-10 Westbound at Dairy Ashford Rd.,US/Central,Night
A-4750747,2,2022-11-11 17:11:00,2022-11-11 18:29:34,30.200547,-97.785648,0.19,Incident on S 1ST ST near EBERHART LN Drive with caution.,US/Central,Day
A-987977,2,2021-06-28 06:44:34,2021-06-28 07:47:22,29.709923,-95.267906,0.0,Right hand shoulder blocked due to accident on I-610 Eastbound at Exits 30B 30C 30D TX-225.,US/Central,Night
A-673352,2,2022-03-17 17:04:28,2022-03-17 17:34:11,29.81287,-95.352539,0.0,Crash on Hardy St at Loop Fwy.,US/Central,Day
A-1725094,2,2019-12-18 08:50:18,2019-12-18 10:28:11,29.803934,-95.374763,0.0,Accident on Cavalcade St at Cordell St.,US/Central,Day
A-1901396,3,2019-09-09 18:06:36,2019-09-09 19:06:16,32.840171999999995,-96.595619,0.0,Lane blocked due to accident on I-30 Westbound at Exit 59.,US/Central,Night
A-2143963,2,2019-04-02 09:32:04,2019-04-02 11:05:05,29.784885,-95.617767,0.0,Accident on Eldridge Pkwy at Ih-10.,US/Central,Day
A-1251827,3,2020-11-25 16:24:42,2020-11-25 17:15:59,29.661148,-95.558029,3.950000047683716,Two lanes blocked due to accident on US-59 Northbound in Westwood.,US/Central,Day
A-2599616,3,2018-09-21 20:47:10,2018-09-21 21:31:49,32.674789000000004,-96.822395,0.0,#1 lane blocked due to accident on I-35E Southbound at Laureland Rd.,US/Central,Night
A-4863149,2,2022-12-03 16:53:30,2022-12-03 17:19:00,29.522859000000004,-98.555843,0.926,Slow traffic on US-87 S - I-10 E from Wurzbach Rd (I-10) to I-410/Exit 564 (I-10) due to accident.,US/Central,Day
A-6572309,2,2021-01-23 20:09:00,2021-01-23 22:32:01.000000000,32.924663,-96.769296,2.325,Slow traffic on I-635 W - LBJ Fwy W from Coit Rd/Exit 19 (I-635) to Montfort Dr (I-635) due to accident.,US/Central,Night
A-3142119,3,2017-12-20 18:53:00,2017-12-20 19:22:42,32.749481,-97.289413,0.0,#1 #2 lane blocked and left hand shoulder blocked due to accident on I-30 Eastbound at Exit 16C Beach St.,US/Central,Night
A-6745110,2,2020-12-17 02:05:00,2020-12-17 04:08:17,32.811141,-96.611092,0.01,Incident on N GALLOWAY AVE near N TOWN EAST BLVD Expect long delays.,US/Central,Night
A-1824425,2,2019-11-15 09:41:21,2019-11-15 10:42:21,29.70521,-95.525223,0.0,Accident on Bellaire Blvd at Osage St.,US/Central,Day
A-1707147,3,2019-12-10 09:18:44,2019-12-10 10:31:24,29.785044,-95.340027,0.0,Right and 3 center lane blocked due to accident on I-69 Southbound at Quitman st.,US/Central,Day
A-3218395,2,2017-10-02 17:51:41,2017-10-02 18:21:32,32.766376,-96.740936,0.0,Accident on Elsie Faye Heggins St at Hatcher St.,US/Central,Day
A-2074181,3,2019-06-26 13:18:06,2019-06-26 14:38:12,29.808525,-95.336105,0.0,Left lane blocked due to accident on I-69 Southbound at I-610 Exits 20 20A 20B.,US/Central,Day
A-2316113,2,2019-01-03 14:06:36,2019-01-03 14:36:27,29.644325,-95.503143,0.0,Accident on Airport Blvd at Sandpiper Dr.,US/Central,Day
A-289499,3,2016-10-06 18:39:15,2016-10-06 19:24:15,29.627016,-98.237167,0.0,Queueing traffic due to accident on I-35 Southbound at Exit 178 FM-1103 Hubertus Rd.,US/Central,Night
A-527060,3,2022-08-25 10:28:52,2022-08-25 11:17:42,32.958698,-96.91394,0.0,Left lane blocked due to crash on I-35E Southbound at Exit 444 Belt Line Rd.,US/Central,Day
A-299121,2,2016-09-06 12:27:41,2016-09-06 12:57:41,29.67223,-95.518364,0.0,Accident on Braeswood Blvd at Murray Brook Dr.,US/Central,Day
A-1047367,2,2021-05-13 10:10:26,2021-05-13 11:19:08,29.67555,-95.591141,0.0,Accident on Bissonnet St at Keegan Rd.,US/Central,Day
A-2939632,2,2018-03-12 08:53:37,2018-03-12 09:23:26,30.421938,-97.845016,0.6299999952316284,Accident on RM-620 Northbound between Wilson Parke Ave and Concordia University Dr.,US/Central,Day
A-6672270,2,2020-12-28 22:50:37,2020-12-29 02:32:37,29.65307,-95.336516,0.053,Incident on MARTIN LUTHER KING BLVD near BAYFIELD DR Drive with caution.,US/Central,Night
A-7262972,4,2020-02-14 20:24:58,2020-02-14 20:54:53,29.862340000000003,-95.40383,0.385,Closed at Little York Rd/Exit 55 - Road closed due to accident.,US/Central,Night
A-4752138,2,2022-10-12 14:18:50,2022-10-12 18:59:10,30.309004,-97.757638,4.172,Slow traffic on TX-1 Loop S from 45th St (TX-1) to TX-1 Loop/S Capital of Texas Hwy (TX-1) due to accident.,US/Central,Day
A-1661613,2,2020-02-21 09:36:34,2020-02-21 11:06:52,30.276951,-97.74337,0.0,Accident on 14th St at Guadalupe St.,US/Central,Day
A-292651,2,2016-08-02 21:12:26,2016-08-02 21:42:26,29.756428000000003,-95.364082,0.0,Accident on Fannin St at McKinney St.,US/Central,Night
A-4121673,2,2022-12-08 15:32:30,2022-12-08 16:05:36,32.942802,-96.742781,0.277,Stationary traffic on S Central Expy from W Main St/W Belt Line Rd (N Central Expy/US-75) to W Spring Valley Rd (N Central Expy/US-75) due to accident.,US/Central,Day
A-7509863,2,2018-11-27 07:39:39,2018-11-27 08:08:51,30.32984,-97.70559,1.1,At US-290/Exit 238 - Accident. Lane blocked.,US/Central,Night
A-2659808,2,2018-08-21 08:47:23,2018-08-21 09:32:06,32.651764,-96.750771,0.0,Accident on Bonnie View Rd both ways around Port Blvd.,US/Central,Day
A-4164660,2,2023-01-03 16:13:30,2023-01-03 17:29:30.000000000,32.652434,-96.873462,3.275,Slow traffic on I-20 W from Wheatland Rd/Exit 465 (I-20) to Cedar Ridge Dr/Exit 461 (I-20) due to accident.,US/Central,Day
A-7066288,3,2020-06-29 09:49:05,2020-06-29 11:09:03,31.75546,-106.34977,0.422,Between Yarbrough Dr/Exit 28B and FM-2316/McRae Blvd/Exit 28A - Accident. Left lane blocked.,US/Mountain,Day
A-2433663,2,2018-11-05 08:00:07,2018-11-05 08:29:46,32.992119,-96.974434,0.0,Left hand shoulder blocked due to accident on Sam Rayburn Tollway Southbound at MacArthur Blvd.,US/Central,Day
A-2854168,2,2018-05-29 15:14:18,2018-05-29 15:44:08,31.716394,-106.327141,0.0,Accident on Pendale Rd at FM-76 Loop Dr.,US/Mountain,Day
A-4332247,2,2022-06-17 01:35:00,2022-06-17 03:31:30.000000000,30.488919,-97.676551,1.013,Stationary traffic on I-35 N from FM-1325/Exit 250 (I-35) to FM-620/Exit 252 (I-35) due to accident.,US/Central,Night
A-1933687,3,2019-08-26 12:33:13,2019-08-26 13:17:31,32.686756,-96.639969,0.0,#1 #2 lane blocked due to accident on I-20 Westbound at Exits 479A 479B 480B I-635 Exit 1C.,US/Central,Day
A-2540910,3,2018-10-24 22:46:34,2018-10-24 23:16:19,30.248053,-97.73542,0.0,Accident on I-35 Southbound at Riverside Dr.,US/Central,Night
A-5903936,2,2021-03-23 10:24:30,2021-03-23 15:24:24,29.67970490441475,-95.42581915809905,0.14,Slow traffic from US-90 Alt/Main St (Buffalo Speedway) to I-610/South Loop W Service Rd (Buffalo Speedway) due to accident.,US/Central,Day
A-1581597,2,2020-01-08 08:11:23,2020-01-08 08:41:12,29.37746,-98.64872,0.0,Accident on Ray Ellison Blvd at New Valley Hi Dr.,US/Central,Day
A-2310834,2,2019-02-27 08:40:26,2019-02-27 09:10:15,29.689095,-95.595932,0.0,Accident on Beechnut St at Cook Rd.,US/Central,Day
A-7748558,3,2019-08-28 18:32:41,2019-08-28 19:02:11,32.97283,-96.92219,0.685,At Sandy Lake Rd/Exit 444 - Accident. Three lanes blocked.,US/Central,Night
A-2976978,2,2018-03-29 04:04:53,2018-03-29 04:34:35,29.667749,-95.382988,0.0,Right hand shoulder blocked due to accident on TX-288 Freeway Southbound at Bellfort St.,US/Central,Night
A-332720,2,2017-01-31 12:50:24,2017-01-31 13:20:14,29.761473,-95.361343,0.01,Accident on Main St at Preston St.,US/Central,Day
A-3052776,2,2018-01-08 06:48:53,2018-01-08 07:33:34,32.779984000000006,-96.769104,0.0,Accident on Ash Ln both ways around 3rd Ave.,US/Central,Night
A-2454235,2,2018-11-13 12:41:47,2018-11-13 13:11:06,29.74765,-95.55793,0.0,Accident on W Sam Houston Pkwy Southbound at TX-8 Sam Houston Pkwy.,US/Central,Day
A-5720773,2,2021-04-22 22:14:00,2021-04-23 00:06:00,32.797905,-97.212082,0.815,Slow traffic on Loop 820 N - I-820 N - TX-121 N from Randol Mill Rd/Exit 26 (I-820) to TX-183/TX-121/TX-10/Exit 24 (I-820) due to accident.,US/Central,Night
A-1038016,2,2021-05-20 08:19:19,2021-05-20 09:04:07,29.902824,-95.552689,0.0,Lane blocked and right hand shoulder blocked due to accident on TX-8-BELTWAY Sam Houston Pkwy Southbound at West Rd.,US/Central,Day
A-2449088,2,2018-11-11 18:19:38,2018-11-11 18:49:18,31.791361,-106.468987,0.0,Accident on Federal Ave at Dakota St.,US/Mountain,Night
A-1943645,2,2019-08-30 13:12:59,2019-08-30 14:50:58,29.742983,-95.358253,0.0,Accident on Emancipation Ave at I-45 Gulf Fwy Exits 44B 44C 45.,US/Central,Day
A-271874,3,2017-01-19 14:17:24,2017-01-19 15:15:28,29.72868,-95.46022,0.01,Queueing traffic and center lane blocked due to accident on I-610 Northbound before I-69.,US/Central,Day
A-4549363,2,2022-10-16 09:31:39,2022-10-16 10:46:40,29.74658,-95.62386,0.045,Incident on WHITTINGTON DR near FORELAND DR Drive with caution.,US/Central,Day
A-869594,3,2021-10-08 13:06:17,2021-10-08 13:50:59,32.659115,-96.88887,0.0,Lane blocked due to accident on I-20 Eastbound at Exit 463 Cockrell Hill Rd.,US/Central,Day
A-5573334,2,2021-08-13 12:59:52,2021-08-13 15:04:29,29.736751,-95.644207,0.111,Stationary traffic on FM-1093 - TX-6 from Miles Dr to Briargreen Dr due to accident.,US/Central,Day
A-791547,3,2021-12-06 08:56:14,2021-12-06 09:40:43,29.778198,-95.124123,0.0,Two lanes blocked and left hand shoulder blocked due to accident on I-10 Eastbound at Sheldon Rd .,US/Central,Day
A-2710742,2,2018-07-18 10:27:20,2018-07-18 11:27:12,29.74157,-95.437096,0.0,Accident on Westheimer Rd at Maconda Ln.,US/Central,Day
A-2490071,3,2018-10-01 09:30:49,2018-10-01 10:15:33,32.759666,-97.114586,0.0,One lane blocked due to accident on I-30 Tom Landry Fwy Westbound at Exits 27 27A 27B Lamar Blvd.,US/Central,Day
A-794477,3,2021-12-03 08:45:19,2021-12-03 09:31:15,30.298691,-97.796432,0.0,Accident on Wildcat Holw at Harbor View Dr.,US/Central,Day
A-2662096,2,2018-08-22 08:38:08,2018-08-22 09:37:55,30.226919,-97.769302,0.0,Accident on 1st St Westbound at US-290.,US/Central,Day
A-6235366,2,2021-08-25 21:22:00,2021-08-25 21:47:30,32.759687,-97.20115,0.7509999999999999,Stationary traffic on I-30 E from I-820/Exit 21 (I-30) to Cooks Ln/Exit 23 (I-30) due to accident.,US/Central,Night
A-1231361,3,2020-12-13 16:54:49,2020-12-13 17:55:37,32.791962,-96.72879,0.0,Three lanes blocked due to accident on I-30 Eastbound at Lawnview Ave.,US/Central,Day
A-486619,2,2017-06-15 12:07:04,2017-06-15 12:36:37,29.84552,-95.333504,0.0,Accident on Tidwell Rd at I-69.,US/Central,Day
A-391064,2,2017-03-16 22:56:50,2017-03-16 23:26:18,32.822197,-96.785973,0.01,#1 lane blocked due to accident on US-75 Southbound at Knox St.,US/Central,Night
A-387260,3,2017-02-27 16:23:49,2017-02-27 16:53:34,32.876197999999995,-96.518517,0.01,One lane blocked due to accident on I-30 Westbound at Exit 64 Dalrock Rd.,US/Central,Day
A-3438256,3,2016-08-07 12:31:51,2016-08-07 18:31:51,33.160636,-97.07095,0.562,At Post Oak Dr/Exit 461 - Accident.,US/Central,Day
A-7064702,4,2020-06-28 12:27:09,2020-06-28 13:27:09,29.70423,-95.27579,0.0,At I-610/Broadway St - Accident.,US/Central,Day
A-903315,2,2021-09-13 06:55:49,2021-09-13 07:25:27,29.64769,-95.356201,0.0,Accident on Airport Blvd at FM-865 Cullen Blvd.,US/Central,Night
A-2939789,2,2018-03-12 16:55:39,2018-03-12 17:25:21,33.012894,-96.843521,0.0,Accident on PGBT Eastbound at Midway Rd.,US/Central,Day
A-7423455,2,2019-03-06 12:04:39,2019-03-06 12:34:02,32.88432,-96.69737,0.382,At Church Rd/Plano Rd/Exit 14 - Accident. Lane blocked.,US/Central,Day
A-1243779,2,2020-12-02 07:36:16,2020-12-02 08:41:34,29.600639,-95.286369,0.0,Accident on TX-8-BELTWAY Sam Houston Pkwy Eastbound at TX-35 Telephone Rd.,US/Central,Night
A-5056945,2,2022-02-22 23:36:30,2022-02-23 01:37:35,32.69118189796118,-96.84653162910055,0.042,Accident on S Hampton Rd (TX-12 Loop) from US-67/Marvin D Love Fwy (TX-12 Loop) to TX-12 Loop.,US/Central,Night
A-1192661,2,2021-01-15 08:48:24,2021-01-15 09:38:02,30.41324,-97.690598,0.0,Accident on FM-734 Parmer Ln at Metric Blvd.,US/Central,Day
A-2419529,2,2018-12-28 09:41:48,2018-12-28 10:11:34,30.337324,-97.683273,0.0,Accident on Cameron Rd at Rutherford Rd.,US/Central,Day
A-6183893,2,2021-11-06 14:09:46,2021-11-06 15:07:03,30.169801,-97.787427,0.217,Stationary traffic from Ralph Ablanedo Dr to Cullen Ln due to accident.,US/Central,Day
A-5424715,2,2022-06-27 10:17:00,2022-06-27 11:34:57.000000,32.759741,-97.18822,0.797,Incident on I-30 EB near COOKS LN Drive with caution.,US/Central,Day
A-5036379,2,2023-01-24 13:58:51,2023-01-24 15:15:28,33.194381,-97.548939,0.014,Incident on W MOCKINGBIRD LN near MAPLE AVE Drive with caution.,US/Central,Day
A-2686734,2,2018-07-04 05:00:24,2018-07-04 05:30:13,29.850012,-95.532089,0.0,Accident on Campbell Rd at Tanner Rd.,US/Central,Night
A-272113,3,2017-01-20 10:08:17,2017-01-20 10:37:12,29.697172,-95.288391,0.01,Lane blocked and left hand shoulder blocked due to accident on I-45 Northbound at Exits 40A 40B 40C 41A Reveille St.,US/Central,Day
A-3768331,2,2022-12-11 05:28:01,2022-12-11 06:43:01,32.705126,-96.832609,0.011,Incident on MARVIN D LOVE FWY SB near W KIEST BLVD Drive with caution.,US/Central,Night
A-5809531,2,2021-12-18 13:18:30,2021-12-18 20:40:30,32.92475,-96.797258,1.368,Slow traffic on I-635 E - LBJ Fwy E from Montfort Dr (I-635) to Coit Rd/Exit 19 (I-635) due to accident.,US/Central,Day
A-3144688,2,2017-12-21 07:50:26,2017-12-21 08:34:58,30.455303000000004,-97.679169,0.0,Accident on Sauls Dr at Bratton Ln.,US/Central,Night
A-7767879,2,2019-08-02 10:21:11,2019-08-02 10:49:43,32.965473,-96.918107,0.414,Between Sandy Lake Rd/Exit 444 and Belt Line Rd - Accident. Lane blocked.,US/Central,Day
A-508539,2,2017-07-12 13:05:51,2017-07-12 13:45:00,32.818771000000005,-96.792862,0.0,Accident on Travis St at Lee St.,US/Central,Day
A-2993820,3,2018-02-06 11:29:55,2018-02-06 12:14:38,32.669525,-96.925705,0.0,Lane blocked due to accident on I-20 Eastbound at Cedar Ridge Dr.,US/Central,Day
A-3073610,3,2018-01-17 06:24:39,2018-01-17 06:54:15,29.376686,-95.005875,0.0,Accident on I-45 Northbound at Exit 12 Gulf Fwy.,US/Central,Night
A-2557357,2,2018-08-31 07:57:37,2018-08-31 08:27:09,29.643866,-95.237862,0.0,Accident on Edgebrook Dr at Rodney St.,US/Central,Night
A-393611,2,2017-03-28 07:56:55,2017-03-28 08:26:45,29.788895,-95.688385,0.01,Accident on Barker Cypress Rd at Park Row.,US/Central,Night
A-2101534,3,2019-05-14 07:44:04,2019-05-14 08:13:41,32.707619,-96.829437,0.0,Accident on I-35E Southbound at US-67.,US/Central,Night
A-3402623,3,2017-08-25 09:50:01,2017-08-25 10:19:41,29.770744,-95.213577,0.0,Lane blocked due to accident on I-10 Eastbound at FM-526 Federal Rd.,US/Central,Day
A-297363,3,2016-08-28 18:03:50,2016-08-28 18:33:50,32.88102,-96.897964,0.0,One lane blocked due to accident on I-35E Southbound at Walnut Hill Ln.,US/Central,Night
A-2415621,4,2018-12-26 10:48:50,2018-12-26 11:17:51,30.244001,-97.735657,2.9800000190734863,Main roadway closed due to accident on I-35 Northbound from Exit 230 US-290 to Exits 232B 233 Woodland Ave. Detour in operation - frontage.,US/Central,Day
A-7158365,2,2020-04-06 16:27:19,2020-04-06 16:57:19,30.38709,-97.64842,0.0,At FM-734/Parmer Ln - Accident.,US/Central,Day
A-3795398,2,2022-04-03 23:56:14,2022-04-04 01:11:14,29.768592,-95.345658,0.003,Incident on NANCE ST near WEST ST Drive with caution.,US/Central,Night
A-4875978,2,2022-12-09 09:29:50,2022-12-09 10:47:15.000000000,32.814878,-96.866217,0.055,Incident on RECORD CROSSING RD near N STEMMONS Expect long delays.,US/Central,Day
A-5428372,2,2022-01-01 02:27:00,2022-01-01 04:31:12.000000000,32.838721,-96.777445,0.172,Slow traffic from Smu Blvd/Yale Blvd (N Central Expy/US-75) to E Mockingbird Ln (N Central Expy/US-75) due to accident.,US/Central,Night
A-1892972,2,2019-09-04 11:39:06,2019-09-04 13:13:38,29.84103,-95.417953,0.0,Accident on Sue Marie Ln at Pinemont Dr.,US/Central,Day
A-3435171,3,2016-09-26 15:21:39,2016-09-26 21:21:39,32.76474,-97.31688,0.072,Ramp to Exit 52B - Accident.,US/Central,Day
A-1676023,2,2020-01-02 11:09:41,2020-01-02 11:54:26,30.265871,-97.782646,0.0,Accident on Mopac Serv Rd Southbound at TX-1-LOOP Mopac Blvd.,US/Central,Day
A-3239229,2,2017-10-11 08:44:08,2017-10-11 09:43:51,30.239639,-97.7612,0.0,Accident on 1st St at Herndon Ln.,US/Central,Day
A-4680483,2,2022-07-03 18:32:34,2022-07-03 19:47:34,29.79793,-95.523975,0.011,Incident on LONG POINT RD near BLALOCK RD Drive with caution.,US/Central,Night
A-4121078,2,2022-11-10 15:25:47,2022-11-10 16:40:47,29.720026,-95.612723,0.069,Incident on OVERTURE DR near ASHFORD POINT DR Drive with caution.,US/Central,Day
A-880951,3,2021-09-28 14:28:21,2021-09-28 15:12:55,30.084841,-95.436485,0.0,One lane blocked due to accident on I-45 I-45 Northbound at Stuebner Rd.,US/Central,Day
A-2312002,2,2019-01-01 06:03:59,2019-01-01 06:49:00,29.724785,-95.476524,0.0,Accident on Westpark Dr at Chimney Rock Rd.,US/Central,Night
A-7714147,2,2019-04-24 10:30:25,2019-04-24 11:00:08,32.64205,-96.82959,0.787,At I-35E/Exit 467 - Accident.,US/Central,Day
A-6833582,2,2020-11-07 02:03:00,2020-11-07 03:55:22,33.872497,-98.533997,0.1689999999999999,Incident on KEMP near CARTER AVE Drive with caution.,US/Central,Night
A-5544192,2,2021-05-03 07:17:00,2021-05-03 13:01:29,32.662186,-96.866991,0.159,Slow traffic from S Hampton Rd (W Camp Wisdom Rd) to US-67/Marvin D Love Fwy (W Camp Wisdom Rd) due to accident.,US/Central,Night
A-7590521,2,2018-04-05 08:48:48,2018-04-05 14:48:48,32.75951,-97.06062,0.638,At TX-360/Six Flags Dr/Exit 30 - Accident.,US/Central,Day
A-1999650,2,2019-08-01 19:00:11,2019-08-01 20:00:19,30.266729,-97.770149,0.0,Accident on Barton Springs Rd at Stratford Dr.,US/Central,Night
A-1425734,3,2020-08-16 17:36:15,2020-08-16 18:36:17,32.852917,-96.562721,0.0,Three lanes blocked and right hand shoulder blocked due to accident on I-30 Eastbound at Zion Rd.,US/Central,Day
A-387284,2,2017-02-27 18:04:52,2017-02-27 18:34:43,29.695967,-95.440125,0.01,Accident on Stella Link Rd at Drummond St.,US/Central,Night
A-2226809,2,2019-03-19 05:57:16,2019-03-19 06:42:36,29.309641,-98.615799,0.0,Accident on I-35 Northbound at Fischer Rd.,US/Central,Night
A-6696998,2,2020-10-27 23:03:11,2020-10-28 06:58:12,33.030032,-96.992646,0.863,Incident on I-35E NB near TX-121 BUSINESS Expect long delays.,US/Central,Night
A-4140549,2,2022-11-12 10:16:47,2022-11-12 11:31:47,29.743572,-95.500912,0.031,Incident on S VOSS RD near OLYMPIA DR Drive with caution.,US/Central,Day
A-279616,2,2016-11-15 18:53:27,2016-11-15 19:23:14,32.743122,-96.82457,0.01,Accident on TX-354 Zang Blvd at Jefferson Blvd.,US/Central,Night
A-293268,2,2016-08-06 17:29:39,2016-08-06 18:44:39,30.32486500000001,-97.693062,0.0,Accident on Cameron Rd at Westheimer Dr.,US/Central,Day
A-4099472,2,2022-02-03 19:31:35,2022-02-03 20:46:35,29.611804,-95.273284,0.026,Incident on FUQUA ST near GULF VALLEY ST Drive with caution.,US/Central,Night
A-7761465,3,2019-07-20 13:44:30,2019-07-20 14:14:12,32.76653,-96.90511,0.322,At TX-12-LOOP/Exit 38 - Accident.,US/Central,Day
A-5103704,2,2022-10-17 14:49:00,2022-10-17 16:06:29.000000000,30.251861,-97.858703,0.458,Incident on SOUTHWEST PKY near RIALTO BLVD Drive with caution.,US/Central,Day
A-5886771,2,2021-06-18 07:33:50,2021-06-18 09:09:06.000000000,32.657722,-96.971555,0.3,Incident on MOUNTAIN CREEK PKWY near PALAZZO LN Drive with caution.,US/Central,Night
A-1395732,2,2020-07-22 15:53:38,2020-07-22 16:53:49,32.662624,-96.783928,0.0,Accident on Simpson Stuart Rd at TX-342 Lancaster Rd.,US/Central,Day
A-570214,1,2022-07-11 06:19:42,2022-07-11 07:04:24,29.97588,-95.493782,0.0,Crash on Sarti St at Brookhead Trl.,US/Central,Night
A-488872,2,2017-06-28 19:33:33,2017-06-28 20:02:43,32.791374,-96.756477,0.0,Accident on Munger Blvd Southbound at Lindsley Ave.,US/Central,Night
A-3364640,2,2017-08-08 09:43:27,2017-08-08 10:13:11,29.86912,-95.412605,0.0,Accident on TX-261 Spur Shepherd Dr at Little York Rd.,US/Central,Day
A-275874,3,2016-11-01 18:18:06,2016-11-01 18:47:33,32.75581,-97.319183,0.01,#1 lane blocked queueing traffic and left hand shoulder blocked due to accident on I-35W Northbound at Exits 51 52A US-287.,US/Central,Night
A-5210172,2,2023-01-29 02:10:07,2023-01-29 03:25:07,32.80198,-96.790274,0.03,Incident on THOMAS AVE near N WASHINGTON AVE Drive with caution.,US/Central,Night
A-2200031,3,2019-03-04 19:04:56,2019-03-04 19:34:10,29.949011,-95.416771,0.0,Left right and center lane blocked due to accident on I-45 Northbound at Greens Rd.,US/Central,Night
A-6866884,2,2020-11-15 07:45:13,2020-11-15 10:45:13,29.808612,-95.365372,0.242,Incident on GRACELAND ST near HELMERS ST Drive with caution.,US/Central,Night
A-7612380,4,2018-03-30 13:58:32,2018-03-30 19:58:32,32.70074,-96.83648,1.214,Closed between Polk St and TX-12-loop - Road closed due to accident.,US/Central,Day
A-2530764,2,2018-10-19 16:10:27,2018-10-19 16:39:57,33.870564,-98.535759,0.0,Accident on Kemp Blvd at Midwestern Pkwy.,US/Central,Day
A-1264982,2,2020-11-16 06:25:58,2020-11-16 07:42:22,29.86727,-95.563408,0.0,Accident on Little York Rd at TX-8-BELTWAY Belt Dr.,US/Central,Night
A-1230401,3,2020-12-14 11:09:22,2020-12-14 12:28:14,32.637627,-97.32151,0.0,Two lanes blocked due to accident on I-35W Northbound at Sycamore School Rd.,US/Central,Day
A-1217567,3,2020-12-23 18:44:26,2020-12-23 19:28:56,32.681183000000004,-97.240639,0.0,Two lanes blocked due to accident on I-820 Southbound at Sun Valley Rd.,US/Central,Night
A-4558228,2,2022-08-19 07:56:33,2022-08-19 08:16:33.000000,32.86116958,-96.90206408,2.204,Stationary traffic on TX-12 Loop S from W Northwest Hwy to N Walton Walker Blvd due to accident.,US/Central,Night
A-2540839,2,2018-10-24 14:49:36,2018-10-24 15:19:23,30.234507,-97.911072,0.0,Accident on Circle Dr at US-290.,US/Central,Day
A-572800,3,2022-07-07 08:13:21,2022-07-07 08:42:43,32.909061,-96.891808,0.0,One lane blocked due to crash on I-635 Westbound at Exits 27B Denton Dr.,US/Central,Day
A-267769,2,2017-01-02 17:43:49,2017-01-02 18:13:28,32.898563,-96.769188,0.01,Accident on US-75 Southbound at Royal Ln.,US/Central,Day
A-3073672,3,2018-01-17 18:57:12,2018-01-17 19:24:46,29.783382,-95.777657,0.5799999833106995,Entry ramp to TX-99 Southbound from I-10 Westbound closed due to ice.,US/Central,Night
A-2395598,2,2018-12-13 06:36:05,2018-12-13 07:05:52,29.531479,-98.562576,0.0,Accident on I-10 Eastbound at Wurzbach Rd.,US/Central,Night
A-639944,3,2022-04-23 14:18:40,2022-04-23 15:17:22,32.686707,-96.640213,0.0,One lane blocked left hand shoulder blocked and right hand shoulder blocked due to crash on I-20 Westbound at Exit 479A / Haymarket Rd.,US/Central,Day
A-3067749,2,2018-01-15 11:41:10,2018-01-15 12:25:56,30.49998900000001,-97.988251,0.0,Accident on RM-1431 at Tessera Pkwy.,US/Central,Day
A-5513948,2,2021-09-14 14:02:00,2021-09-14 15:18:22,30.334195,-97.738497,0.197,Incident on W KOENIG LN near WILLIAM HOLLAND AVE Drive with caution.,US/Central,Day
A-273581,2,2017-01-26 17:59:53,2017-01-26 18:29:42,30.333979,-97.721283,0.01,Accident on Brentwood St at Lamar Blvd.,US/Central,Day
A-484730,2,2017-06-06 07:51:53,2017-06-06 08:21:42,29.71658900000001,-95.548737,0.0199999995529651,Accident on Harwin Dr at Ranchester Dr.,US/Central,Night
A-5667088,2,2021-08-19 20:58:00,2021-08-19 22:38:22,30.234917,-97.840039,0.043,Incident on MONTEREY OAKS BLVD near STAGGERBRUSH RD Drive with caution.,US/Central,Night
A-385908,2,2017-02-21 08:03:41,2017-02-21 08:33:29,30.004047,-95.372192,0.01,Accident on Aldine Westfield Rd at Richey Rd.,US/Central,Day
A-2229793,2,2019-03-20 08:21:49,2019-03-20 09:06:22,31.783989,-106.441299,0.0,Left hand shoulder closed due to accident on Us-54 Southbound at Montana Ave.,US/Mountain,Day
A-950875,3,2021-08-02 04:04:24,2021-08-02 05:03:53,32.694881,-96.629753,0.0,Three lanes blocked due to accident on I-20 Westbound at US-175.,US/Central,Night
A-7627260,2,2018-01-03 15:28:07,2018-01-03 21:28:07,29.25453,-95.45288,0.99,At TX-288-br - Accident. Right lane blocked.,US/Central,Day
A-2134520,2,2019-04-30 10:02:58,2019-04-30 11:10:33,29.75227000000001,-95.373688,0.0,Accident on Smith St at St Joseph Pkwy.,US/Central,Day
A-431649,2,2017-04-18 07:47:24,2017-04-18 08:32:12,30.247168,-97.805,0.01,Accident on MoPac Expy Southbound at TX-360 Capital of Texas Hwy.,US/Central,Night
A-2302461,2,2019-02-22 07:46:21,2019-02-22 08:32:00,29.60194000000001,-95.480797,0.0,Accident on Fuqua Dr at Summer Ridge Dr.,US/Central,Night
A-277369,2,2016-11-08 07:21:37,2016-11-08 08:05:57,32.868145,-96.943428,0.01,#2 lane blocked due to accident on TX-114 John Carpenter Fwy Westbound at N O'Connor Blvd.,US/Central,Night
A-5502024,2,2021-09-04 18:23:00,2021-09-04 20:28:25,32.941695,-96.768996,0.138,Stationary traffic from Haymeadow Dr to Regency Dr due to accident.,US/Central,Night
A-6282432,2,2021-05-22 21:48:55,2021-05-22 23:25:19.000000000,32.735982,-97.298873,0.765,Incident on US-287 NB near VICKERY Three lanes blocked. Expect delays.,US/Central,Night
A-5697335,2,2021-07-09 16:49:15,2021-07-09 19:51:28,29.423808,-98.389158,1.144,Incident on I-410 NB near I-10 Drive with caution.,US/Central,Day
A-3693111,2,2023-03-28 07:19:36,2023-03-28 13:19:35,30.182804,-97.541113,0.245,Accident,US/Central,Night
A-508874,2,2017-07-13 18:03:11,2017-07-13 18:33:05,30.454590000000003,-97.556831,0.0,Accident on Kelly Ln at Weiss Ln.,US/Central,Night
A-1655077,2,2020-02-18 06:23:10,2020-02-18 07:25:25,30.187031,-97.772522,0.0,Accident on I-35 Northbound at Boggy Creek Dr.,US/Central,Night
A-5211323,4,2022-11-04 14:07:00,2022-11-04 15:27:55.000000000,30.129216,-95.230006,0.103,Incident on TX-99 FRONTAGE RD EB near EASTEX FWY RD Road closed. Take alternate route.,US/Central,Day
