ID,Severity,Start_Time,End_Time,Start_Lat,Start_Lng,Distance(mi),Description,Timezone,Sunrise_Sunset
A-2884424,3,2018-04-13 15:54:01,2018-04-13 16:24:01,32.175709000000005,-96.470695,0.0,Accident on I-45 Northbound at Exit 237 McKinney St.,US/Central,Day
A-5381873,2,2022-10-04 16:13:23,2022-10-04 17:34:09,32.36235300000001,-95.345498,0.029,Incident on LION LN near LEON DR Drive with caution.,US/Central,Day
A-300495,2,2016-06-21 18:54:42,2016-06-21 19:24:42,29.736832,-95.559875,0.0,Accident on FM-1093 Westheimer Rd at Rogerdale Rd.,US/Central,Night
A-2648291,2,2018-08-15 11:31:30,2018-08-15 12:01:20,29.691168,-95.535194,0.0,Accident on Gessner Rd at Beechnut St.,US/Central,Day
A-1756092,2,2019-10-15 16:13:47,2019-10-15 18:02:00,31.760441,-106.403732,0.0,Accident on Delta Dr Eastbound at Malaga Pl.,US/Mountain,Day
A-4950399,2,2022-03-23 17:28:34,2022-03-23 18:17:18,32.952659999999995,-96.768973,0.166,Slow traffic from W Arapaho Rd (Coit Rd) to W Spring Valley Rd (Coit Rd) due to accident.,US/Central,Day
A-6908336,2,2020-11-21 13:02:13,2020-11-21 15:42:23,32.903934,-97.317076,1.108,Incident on I-35 NB near HERITAGE TRACE Expect long delays.,US/Central,Day
A-2906469,2,2018-04-24 08:10:48,2018-04-24 08:40:34,29.675964,-95.542091,0.0,Accident on Bissonnet St at I-69.,US/Central,Day
A-5715593,2,2021-06-29 16:21:40,2021-06-29 17:36:40.000000,30.668012,-96.373024,0.095,Incident on TABOR ST near N MAIN ST Drive with caution.,US/Central,Day
A-1452512,2,2020-05-29 17:28:01,2020-05-29 18:12:46,29.378719,-98.504311,0.0,Accident on Pleasanton Rd at Hart Ave.,US/Central,Day
A-2719388,3,2018-07-23 04:28:34,2018-07-23 04:58:10,29.812458000000003,-94.93853,0.0,Two lanes blocked due to accident on I-10 Eastbound at Sjolander Rd.,US/Central,Night
A-6048159,2,2021-11-18 14:02:00,2021-11-18 15:20:36,31.763204,-106.257995,0.248,Incident on SUN FIRE BLVD near SUN TERRACE AVE Drive with caution.,US/Mountain,Day
A-2853607,3,2018-05-29 16:24:56,2018-05-29 16:54:37,32.708183,-97.23156,0.0,#1 lane blocked and left hand shoulder blocked due to accident on I-820 Southbound at Berry St.,US/Central,Day
A-388537,2,2017-03-05 08:04:31,2017-03-05 08:33:48,32.817623,-96.871048,0.01,Accident on TX-183 John Carpenter Fwy Northbound at Mockingbird Ln.,US/Central,Day
A-2884447,3,2018-04-13 21:49:27,2018-04-13 22:19:07,32.85593,-96.648865,0.0,#1 lane blocked due to accident on I-635 Southbound at Centerville Rd.,US/Central,Night
A-394366,3,2017-03-30 19:54:12,2017-03-30 20:23:47,29.516769,-98.464363,0.01,Left hand shoulder blocked due to accident on I-410 Westbound at Broadway St.,US/Central,Night
A-3226651,2,2017-10-05 10:43:17,2017-10-05 11:43:04,30.178804,-97.829903,0.0,Accident on Piping Rock Trl at Willers Way.,US/Central,Day
A-5563311,2,2021-08-15 17:54:00,2021-08-15 19:58:32,30.193327000000004,-97.779813,0.094,Slow traffic from Manchaca Rd (W William Cannon Dr) to I-35 (E William Cannon Dr) due to accident.,US/Central,Day
A-6785845,2,2020-12-18 22:54:00,2020-12-19 02:34:30.000000000,29.426917,-98.501181,0.5760000000000001,Slow traffic on US-87 S - I-10 E - I-35 S from I-10/US-87/Exit 156 (I-35/I-10) to El Paso St (I-35/I-10) due to accident.,US/Central,Night
A-2891560,2,2018-04-17 11:40:57,2018-04-17 12:10:45,31.726768,-106.286095,0.0,Accident on John Phelan Dr at James Cravens Ct.,US/Mountain,Day
A-3444916,2,2016-07-28 12:39:16,2016-07-28 18:39:16,29.73011,-95.44859,0.388,Between Newcastle Dr and I-610 (South) - Accident.,US/Central,Day
A-1826260,3,2019-11-17 17:48:49,2019-11-17 22:28:51,29.640654,-95.242729,0.0,Three lanes blocked and left hand shoulder blocked due to accident on Gulf Fwy Southbound at Redford St.,US/Central,Day
A-1138015,2,2021-02-26 13:39:59,2021-02-26 14:09:21,30.380648,-97.738899,0.0,#6 lane blocked due to accident on US-183 Southbound at TX-1-LOOP Mopac Blvd.,US/Central,Day
A-7599567,2,2018-02-28 06:41:05,2018-02-28 12:41:05,29.60942,-95.38658,0.708,At Almeda-Genoa Rd - Accident. Left lane blocked. Hard shoulder blocked.,US/Central,Night
A-3164054,2,2017-11-02 12:40:42,2017-11-02 13:25:27,30.208267,-97.773201,0.0,Accident on Congress Ave at Mockingbird Ln.,US/Central,Day
A-1807941,2,2019-11-08 14:27:20,2019-11-08 15:57:44,30.227711,-97.788261,0.0,Accident on Redd St at Merle Dr.,US/Central,Day
A-3440986,4,2016-09-05 02:38:03,2016-09-05 08:38:03,29.528270000000006,-95.13048,1.358,Closed at FM-518/Exit 23 - Road closed due to accident.,US/Central,Night
A-3201990,2,2017-11-22 15:40:19,2017-11-22 16:10:01,31.776138,-106.267845,0.0,Accident on Joe Battle Blvd Southbound at Pebble Hills Blvd.,US/Mountain,Day
A-5216454,2,2022-12-24 19:53:00,2022-12-24 21:14:13,30.276506,-97.702589,0.136,Incident on E 12TH ST near MC KINLEY AVE Drive with caution.,US/Central,Night
A-304846,3,2016-07-20 08:59:00,2016-07-20 10:14:00,32.839256,-97.264183,0.0,Right hand shoulder blocked and #2 lane blocked due to accident on I-820 Eastbound at Exit 19 US-377 Denton Hwy.,US/Central,Day
A-7578817,4,2018-05-03 05:47:10,2018-05-03 11:47:10,32.863361,-96.811636,0.318,Closed at TX-12-loop - Road closed due to accident.,US/Central,Night
A-3296331,2,2017-09-08 09:20:23,2017-09-08 09:50:12,29.72118900000001,-95.520309,0.0,Accident on Fondren Rd at Westpark Tollway.,US/Central,Day
A-2297260,2,2019-02-20 07:23:07,2019-02-20 07:53:00,32.864075,-96.66658,0.0,Accident on Shiloh Rd at Northwest Hwy.,US/Central,Night
A-1395706,2,2020-07-22 06:02:46,2020-07-22 06:31:57,32.868641,-96.761147,0.0,Accident on Melody Ln near Hemlock Ln.,US/Central,Night
A-875664,3,2021-10-05 08:13:18,2021-10-05 08:42:38,32.926056,-96.810928,0.0,Left lane blocked due to accident on I-635 Eastbound at Montfort Dr.,US/Central,Day
A-3224188,2,2017-10-04 06:46:54,2017-10-04 07:16:42,29.854958,-95.515465,0.0,Accident on Northwest Fwy at Guhn Rd.,US/Central,Night
A-4301228,2,2022-08-30 13:03:30,2022-08-30 13:28:00,32.783203,-96.788644,0.769,Stationary traffic on US-75 N from Elm St/Main St/Exit 284 (US-75) to Ross Ave/Exit 286 (US-75) due to accident.,US/Central,Day
A-1667272,2,2020-02-25 09:40:23,2020-02-25 10:10:10,30.418289,-97.70089,0.0,Accident on FM-734 Parmer Ln at Tomanet Trl.,US/Central,Day
A-1340249,2,2020-10-14 06:57:10,2020-10-14 08:13:26,32.71653,-96.78759,0.0,Accident on Kiest Blvd at Sunnyvale St.,US/Central,Night
A-5090013,2,2022-04-22 07:15:30,2022-04-22 09:18:10,32.89417147620728,-96.4802920813728,2.112,Accident on US-67/Village Dr/Horizon Rd/Exit 67 (I-30) from Dalrock Rd/Exit 64 (I-30) to US-67 S - I-30 W.,US/Central,Night
A-1854864,2,2019-09-30 20:35:57,2019-09-30 22:01:40,32.807289000000004,-96.793266,0.0,Lane blocked due to accident on US-75 Northbound at Haskell Ave.,US/Central,Night
A-2793262,2,2018-04-30 19:05:23,2018-04-30 19:34:22,30.237324,-97.822952,0.0,#1 #2 lane blocked due to accident on MoPac Expy Northbound at Southwest Pkwy.,US/Central,Night
A-2562452,2,2018-09-04 08:43:48,2018-09-04 09:28:37,32.769432,-96.68277,0.0,Accident on TX-12 Loop Buckner Blvd near Military Pkwy.,US/Central,Day
A-5726092,2,2021-12-29 19:25:00,2021-12-29 20:19:00.000000000,32.921226000000004,-96.75131,1.029,Stationary traffic on LBJ Express - I-635 E - LBJ Fwy E from I-635/LBJ Fwy (West) (I-635 HOV) to I-635/LBJ Fwy Local Lane Access (I-635 HOV) due to accident.,US/Central,Night
A-6602323,2,2020-11-21 03:44:20,2020-11-21 06:02:21,32.892125,-96.890243,0.055,Incident on HARRY HINES BLVD near FABENS RD Drive with caution.,US/Central,Night
A-3436063,2,2016-10-05 11:04:17,2016-10-05 17:04:17,32.773008000000004,-96.836188,0.002,At Commerce St - Accident.,US/Central,Day
A-6388081,2,2021-02-21 15:21:32,2021-02-21 16:57:33,29.656594,-95.477417,0.067,Incident on CHIMNEY ROCK RD near MCKNIGHT ST Drive with caution.,US/Central,Day
A-5231552,2,2022-07-05 12:56:34,2022-07-05 14:32:35,29.64471,-95.482044,0.115,Incident on CHIMNEY ROCK RD near W AIRPORT BLVD Drive with caution.,US/Central,Day
A-7734038,2,2019-06-05 12:06:12,2019-06-05 12:34:20,32.81233,-96.79121,0.789,At Blackburn St/Haskell Ave/Exit 1 - Accident. Lane blocked.,US/Central,Day
A-675622,3,2022-03-16 06:28:24,2022-03-16 07:12:37,29.598417,-95.622459,0.0,Two lanes blocked due to crash on I-69 Southwest Fwy Frontage Rd Northbound at TX-6.,US/Central,Night
A-3070477,2,2018-01-16 14:00:30,2018-01-16 14:45:20,30.17379600000001,-97.823753,0.0,Accident on Slaughter Ln at FM-2304 Manchaca Rd.,US/Central,Day
A-3782911,2,2022-11-09 16:07:00,2022-11-09 16:56:19,32.628785,-96.904641,0.953,Slow traffic on US-67 S - S G Alexander Fwy - J Elmer Weaver Fwy - Marvin D Love Fwy S from Danieldale Rd (US-67) to Wintergreen Rd (US-67) due to accident.,US/Central,Day
A-5498418,2,2021-11-13 23:50:56,2021-11-14 01:05:56.000000000,29.785058000000006,-95.55609,0.068,Incident on KATY FWY near SHADOWDALE DR Drive with caution.,US/Central,Night
A-265666,2,2016-12-20 11:01:49,2016-12-20 11:46:35,30.225779,-97.868675,0.0,Accident on Convict Hill Rd at Escarpment Blvd.,US/Central,Day
A-6896869,2,2020-12-23 12:56:00,2020-12-23 14:35:58,30.268288,-97.740029,0.067,Incident on E 6TH ST near SAN JACINTO BLVD Drive with caution.,US/Central,Day
A-296228,2,2016-08-22 21:43:19,2016-08-22 22:43:19,32.739853000000004,-96.893974,0.0,Accident on Higgins Ave near Calumet Ave.,US/Central,Night
A-3386935,3,2017-08-18 14:09:03,2017-08-18 14:38:42,32.797668,-97.21209,0.0,Lane blocked and left hand shoulder blocked due to accident on I-820 Northbound at Exit 25 Trinity Blvd.,US/Central,Day
A-3189995,2,2017-11-16 10:05:39,2017-11-16 10:32:24,29.627747,-95.446159,0.0,Accident on Orem Dr at Hiram Clarke Rd.,US/Central,Day
A-4794420,2,2022-10-03 11:51:00,2022-10-03 13:11:46,30.266187,-97.743476,0.068,Incident on CONGRESS AVE near E 4TH ST Drive with caution.,US/Central,Day
A-452740,2,2017-05-22 09:12:33,2017-05-22 09:42:16,29.725718,-95.476395,0.0199999995529651,Accident on Chimney Rock Rd at I-69.,US/Central,Day
A-290695,2,2016-10-13 07:56:48,2016-10-13 08:26:48,32.589867,-96.891846,0.01,Accident on Cockrell Hill Rd Southbound at FM-1382 Belt Line Rd.,US/Central,Night
A-1875007,2,2019-09-23 09:16:39,2019-09-23 10:34:10,29.703705,-95.58786,0.0,Accident on Bellaire Blvd at Kirkwood Rd.,US/Central,Day
A-5947290,2,2021-11-05 16:11:57,2021-11-05 18:36:08,32.909202,-96.733853,0.121,Stationary traffic from I-635 W to Forest Springs Dr due to accident.,US/Central,Day
A-2726071,3,2018-07-26 12:41:51,2018-07-26 13:10:39,32.861073,-97.31472,0.0,Heavy traffic and right lane closed due to accident on I-35W Southbound after Exits 58 59 Western Center Blvd.,US/Central,Day
A-1627711,2,2020-02-04 06:10:04,2020-02-04 08:09:46,32.808479,-96.705681,0.0,Accident on St Francis Ave at Ferguson Rd.,US/Central,Night
A-3435095,3,2016-09-24 21:53:46,2016-09-25 03:53:46,29.749589,-95.45611,0.598,Between FM-1093/Westheimer Rd/Exit 8 and Richmond Ave/Exit 8 - Accident.,US/Central,Night
A-2645679,3,2018-08-14 13:33:23,2018-08-14 14:02:57,32.894493,-96.711494,0.0,Lane blocked due to accident on I-635 Westbound at I-635 Exit 15 / Royal Ln.,US/Central,Day
A-4668676,2,2022-05-19 21:49:12,2022-05-19 23:04:12,32.922493,-96.809875,0.13,Incident on HARVEST HILL RD near SPURLING DR Drive with caution.,US/Central,Night
A-4154452,2,2022-12-19 20:10:52,2022-12-19 21:25:52,29.857676,-95.470142,0.092,Incident on HOLLY VIEW DR near STATLER DR Drive with caution.,US/Central,Night
A-3250586,2,2017-10-17 19:42:52,2017-10-17 20:42:13,33.236664000000005,-97.062057,5.199999809265137,Accident on US-380 University Dr both ways between US-377 University Dr and Lakeview Blvd.,US/Central,Night
A-2056294,2,2019-06-17 08:34:35,2019-06-17 09:19:29,32.687225,-96.891457,0.0,Accident on Cockrell Hill Rd at Bronze Way.,US/Central,Day
A-6328201,2,2021-07-11 15:13:11,2021-07-11 17:18:27,32.909224,-96.744868,0.151,Stationary traffic from Judd Ct to Windy Crest Dr due to accident.,US/Central,Day
A-4913741,2,2022-12-06 06:39:30,2022-12-06 07:19:00.000000000,32.839664,-96.914523,2.524,Slow traffic on TX-12 Loop N from Texas Plaza Dr (TX-12 Loop) to I-35E (TX-12 Loop) due to accident.,US/Central,Night
A-4373269,2,2023-02-08 07:24:30,2023-02-08 07:49:30,32.74744391,-97.4927938,0.802,Stationary traffic on Westpoint Blvd from Academy Blvd to I-820 due to accident.,US/Central,Night
A-3241969,2,2017-10-12 07:20:20,2017-10-12 08:04:56,32.836903,-96.951187,0.0,Lane blocked due to accident on TX-183 Eastbound at TX-183 / O'Connor Rd.,US/Central,Night
A-7627950,3,2018-01-04 15:34:44,2018-01-04 21:34:44,29.77728,-95.42233,0.653,At TC Jester Blvd/Exit 765 - Accident. Right lane blocked.,US/Central,Day
A-2127270,3,2019-05-28 16:42:52,2019-05-28 17:12:29,32.675663,-97.023811,0.0,Right lane blocked due to accident on I-20 at Lake Ridge Pkwy.,US/Central,Day
A-6599838,2,2020-12-16 02:20:53,2020-12-16 05:20:54,32.640348,-96.840038,0.011,Incident on BECKLEYMEADE AVE near S POLK ST Drive with caution.,US/Central,Night
A-6878366,2,2020-10-16 21:10:00,2020-10-16 23:02:19,33.88855,-98.464258,0.22,Incident on SUNNYSIDE near LUCAS AVE Drive with caution.,US/Central,Night
A-2411086,2,2018-12-21 11:36:38,2018-12-21 12:06:06,32.785519,-96.797592,0.0,Accident on Harwood St near Wenchell Ln.,US/Central,Day
A-1031746,3,2021-05-25 13:25:23,2021-05-25 14:10:00,32.699622999999995,-96.500984,0.0,Lane blocked due to accident on I-20 Westbound at Exit 487 FM-740.,US/Central,Day
A-1276266,3,2020-11-08 11:30:12,2020-11-08 13:17:56,32.666248,-97.241402,0.0,One lane blocked due to accident on I-820 Southbound at I-20 .,US/Central,Day
A-1856970,2,2019-10-01 08:10:34,2019-10-01 09:10:23,30.44675100000001,-97.74379,0.0,Accident on FM-734 Parmer Ln at Corpus Christi Dr.,US/Central,Day
A-2202449,2,2019-03-05 16:39:03,2019-03-05 17:08:46,29.7328,-95.212646,0.0,Accident on Federal Rd at Clinton Dr.,US/Central,Day
A-5297395,2,2023-01-18 21:55:01,2023-01-19 01:17:03.000000000,29.770778000000004,-95.372356,0.051,Incident on HOUSTON AVE near EDWARDS ST Drive with caution.,US/Central,Night
A-1750196,2,2019-10-12 13:11:38,2019-10-12 13:40:41,32.697964,-97.237534,0.0,Accident on I-820 Southbound at Willbarger.,US/Central,Day
A-2810241,2,2018-05-08 05:19:15,2018-05-08 06:03:27,30.37966,-97.739372,0.5299999713897705,Accident on entry ramp to Mopac Expy Southbound from US-183 Southbound.,US/Central,Night
A-5802356,2,2021-10-21 16:21:58,2021-10-21 18:42:27.000000000,32.855082,-96.87258,0.123,Slow traffic on TX-12 Loop from Starlight Rd to Straightway Dr due to accident.,US/Central,Day
A-334435,3,2017-02-07 17:22:15,2017-02-07 17:52:02,30.288004,-97.723686,0.01,Accident on I-35 Service Rd Northbound at 30th St.,US/Central,Day
A-2570347,2,2018-09-07 17:06:36,2018-09-07 17:36:25,30.234062,-97.86467,0.0,Accident on US-290 Westbound at William Cannon Dr.,US/Central,Day
A-1433103,3,2020-08-21 07:47:12,2020-08-21 08:16:52,32.785789,-96.767235,0.0,One lane blocked and shoulder blocked due to accident on I-30 Westbound at Haskell Ave .,US/Central,Night
A-1331946,2,2020-10-08 07:56:14,2020-10-08 09:14:19,29.951059000000004,-95.358513,0.0,Accident on Aldine Westfield Rd at Greens Rd.,US/Central,Night
A-722840,2,2022-02-03 19:18:56,2022-02-03 20:18:54,29.696899,-95.372566,0.0,Accident on Peerless St at Yellowstone Blvd.,US/Central,Night
A-536381,1,2022-08-16 07:50:02,2022-08-16 08:19:30,30.341999,-97.536819,0.0,Crash on Old Tx-20 at Skimmer Run.,US/Central,Night
A-2027743,3,2019-08-16 09:48:28,2019-08-16 10:48:01,33.129688,-97.039261,0.0,Right lane blocked and right hand shoulder blocked due to accident on I-35E Southbound at Swisher Rd.,US/Central,Day
A-2391633,3,2018-12-11 20:02:34,2018-12-11 20:32:06,29.784576,-95.575623,0.0,Two lane blocked and left hand shoulder blocked due to accident on I-10 Westbound at Wilcrest Dr.,US/Central,Night
A-2537925,3,2018-10-23 22:32:02,2018-10-23 23:01:51,29.4387,-98.477654,0.0,Accident on I-35 Southbound at US-281.,US/Central,Night
A-4218782,2,2022-01-29 15:07:32,2022-01-29 16:22:33.000000000,29.62940900000001,-95.213598,0.087,Incident on CEDAR MESA DR near SHASTA SPRINGS DR Drive with caution.,US/Central,Day
A-486004,3,2017-06-13 07:27:35,2017-06-13 08:12:16,29.516769,-98.464363,0.0,Right hand shoulder blocked due to accident on I-410 Eastbound at Exits 21 23 Broadway St.,US/Central,Night
A-2093149,3,2019-05-09 10:34:48,2019-05-09 11:35:10,32.713177,-96.302917,0.0,Right hand shoulder blocked due to accident on I-20 Eastbound at TX-557-SPUR.,US/Central,Day
A-281041,2,2016-11-20 22:35:11,2016-11-20 23:19:47,29.669153,-95.262543,0.01,Accident on TX-3 Monroe Rd both ways at I-45.,US/Central,Night
A-2069250,2,2019-06-24 08:36:51,2019-06-24 12:32:00,30.339211,-97.700081,0.0,Accident on I-35 Southbound at Anderson Ln.,US/Central,Day
A-2268187,2,2019-02-06 07:35:17,2019-02-06 08:04:58,30.202341,-97.639603,0.0,Accident on FM-973 at TX-71.,US/Central,Night
A-1403038,2,2020-07-28 10:01:55,2020-07-28 11:36:11,29.725241,-95.377907,0.0,Accident on Rosedale St at Almeda Rd.,US/Central,Day
A-2596703,2,2018-09-20 07:01:40,2018-09-20 07:31:06,32.767536,-97.309006,0.0,One lane blocked due to accident on TX-121 Westbound at Sylvania Ave.,US/Central,Night
A-5754208,2,2021-08-13 20:08:00,2021-08-13 20:21:00,31.776929,-106.46528899999998,0.545,Slow traffic on US-180 E - I-10 E from Gateway Blvd (I-10) to TX-478 Loop/Copia St/Exit 22A (I-10) due to accident.,US/Mountain,Night
A-3432292,2,2016-11-09 17:44:55,2016-11-09 23:44:55,29.46405,-98.62101,1.182,At Culebra Rd/Exit 10 - Accident.,US/Central,Day
A-7472859,4,2018-11-30 17:12:49,2018-11-30 17:42:23,30.18621,-97.609276,0.179,Closed at Burch Dr - Road closed due to accident.,US/Central,Day
A-5991129,2,2021-11-16 19:07:30,2021-11-16 21:20:45,30.249792,-97.766869,0.23,Slow traffic on TX-343 from Evergreen Ave / Collier St to Thornton Rd due to accident.,US/Central,Night
A-433178,2,2017-04-24 17:54:59,2017-04-24 18:24:24,30.33469,-97.748848,0.0,Accident on Shoal Creek Blvd both ways near RM-2222 Allandale Rd / RM-2222 Northland Dr.,US/Central,Day
A-7017347,3,2020-05-08 06:47:27,2020-05-08 07:02:27,33.01678,-96.20895,0.0,At FM-1565/Exit 83 - Accident.,US/Central,Night
A-5526943,2,2021-11-30 10:46:29,2021-11-30 12:01:30.000000000,29.661211,-95.25392,0.208,Incident on CANNIFF ST near BRACKNELL ST Drive with caution.,US/Central,Day
A-1418245,2,2020-08-10 10:17:38,2020-08-10 11:59:49,30.179449,-95.534508,0.0,Accident on Kuykendahl Rd at Woodlands Pkwy.,US/Central,Day
A-2939981,2,2018-03-12 13:08:18,2018-03-12 13:38:02,29.737473,-95.514214,0.0,Accident on FM-1093 Westheimer Rd at Dunvale Rd.,US/Central,Day
A-4485043,2,2022-12-14 21:50:00,2022-12-15 02:00:00,30.464356,-97.467298,0.485,Incident on FM-973 SB near FM-1660 Road closed. Take alternate route.,US/Central,Night
A-5008613,2,2022-01-16 20:09:00,2022-01-16 20:22:30.000000000,32.912438,-96.736787,0.5529999999999999,Slow traffic on I-635 W - LBJ Fwy W from Abrams Rd (I-635) to Floyd Rd/Exit 18 (I-635) due to accident.,US/Central,Night
A-280043,2,2016-11-16 21:57:21,2016-11-16 22:27:09,29.697012,-95.412354,0.01,Accident on Braeswood Blvd at Main St.,US/Central,Night
A-3039036,3,2017-12-31 12:12:19,2017-12-31 12:56:49,32.642101000000004,-96.823135,0.0,Two lanes blocked due to accident on I-20 Westbound at Exits 467A 467B I-35E.,US/Central,Day
A-1938611,2,2019-08-28 06:21:30,2019-08-28 06:51:16,29.71771,-95.538979,0.0,Accident on Gessner Rd at Harwin Dr.,US/Central,Night
A-1099349,2,2021-03-31 05:31:55,2021-03-31 06:16:26,32.756015999999995,-96.617462,0.0,Accident on I-635 Eastbound at New Market Rd.,US/Central,Night
A-2382857,3,2018-12-06 06:29:22,2018-12-06 06:59:04,29.521259000000004,-98.394768,0.0,One lane blocked and shoulder blocked due to accident on I-35 Southbound at Exit 166 I-410.,US/Central,Night
A-3568648,2,2017-03-07 07:27:35,2017-03-07 13:27:35,29.943739,-95.525219,1.024,At Sam Houston Tollway - Accident.,US/Central,Night
A-3166504,3,2017-11-03 15:42:40,2017-11-03 16:27:26,30.240667,-97.736488,0.0,Accident on I-35 Northbound at Woodland Ave.,US/Central,Day
A-4026605,2,2022-09-30 17:48:00,2022-09-30 19:08:43,30.167505,-97.793108,0.01,Incident on ALICE MAE LN near W SLAUGHTER LN Drive with caution.,US/Central,Day
A-7178782,2,2020-04-15 19:50:53,2020-04-15 20:40:51,30.24998,-97.86653,0.0,At US-290 - Accident.,US/Central,Night
A-2673323,3,2018-08-28 07:43:12,2018-08-28 08:42:52,30.254963,-97.737106,0.0,Accident on I-35 SVRD Southbound at San Marcos St.,US/Central,Night
A-2701144,2,2018-07-12 06:32:05,2018-07-12 07:01:48,29.849037,-95.505539,0.0,Lane blocked due to accident on US-290 Northwest Fwy Westbound at Hollister St.,US/Central,Night
A-1005845,3,2021-06-14 08:25:13,2021-06-14 11:29:58,32.842682,-97.342758,0.0,Left lane blocked due to accident on I-820 Eastbound at FM-156 Blue Mound Rd.,US/Central,Day
A-282145,2,2016-11-24 11:19:13,2016-11-24 11:49:13,29.737724,-95.49485,0.0,Accident on Briargrove Dr at FM-1093 Westheimer Rd.,US/Central,Day
A-452481,2,2017-05-19 18:00:24,2017-05-19 18:29:56,29.938082,-95.268547,0.0,Left hand shoulder blocked and left and center lane blocked due to accident on Sam Houston Pkwy Eastbound before Mesa Dr.,US/Central,Night
A-712937,2,2022-02-11 19:22:14,2022-02-11 20:07:01,29.705040000000004,-95.527489,0.0,Crash on Bellaire Blvd at Waldo St.,US/Central,Night
A-434677,2,2017-05-02 11:50:19,2017-05-02 12:19:50,29.717697,-95.538979,0.01,Accident on Harwin Dr at Gessner Rd.,US/Central,Day
A-1717411,3,2019-12-15 15:52:08,2019-12-15 16:39:36,29.47341500000001,-98.611893,0.0,Accident on I-410 Northbound at Exits 10 11 I-410-Loop.,US/Central,Day
A-796474,2,2021-12-02 06:57:35,2021-12-02 07:44:22,29.848440000000004,-95.310928,0.0,Accident on Tidwell Rd at Allwood St.,US/Central,Night
A-5286591,2,2022-03-19 11:38:33,2022-03-19 12:46:17,32.646095,-96.860748,0.223,Stationary traffic from I-20/W Wheatland Rd (I-20 Frontage) to S Hampton Rd (I-20 Frontage) due to accident.,US/Central,Day
A-4295496,2,2022-12-02 19:56:38,2022-12-02 21:11:38,29.723642,-95.566981,0.025,Incident on WALNUT BEND LN near WILCREST GREEN DR Drive with caution.,US/Central,Night
A-3009556,3,2018-02-13 19:02:14,2018-02-13 19:31:56,32.642101000000004,-96.823135,0.0,#3 #4 lane blocked due to accident on I-35E Southbound at I-20.,US/Central,Night
A-2636473,2,2018-08-09 12:45:47,2018-08-09 13:15:35,30.33734500000001,-97.757095,0.0,Accident on Balcones Dr at RM-2222 Northland Dr.,US/Central,Day
A-1933482,2,2019-08-26 16:41:39,2019-08-26 18:26:24,30.25526,-97.72242,0.0,Accident on Anthony St at Willow St.,US/Central,Day
A-2143580,2,2019-04-02 17:11:48,2019-04-02 17:40:58,32.705479,-96.932991,0.0,Accident on TX-303-SPUR Kiest Blvd Southbound at TX-408-SPUR.,US/Central,Day
A-3161946,2,2017-11-01 17:48:25,2017-11-01 18:48:04,29.728586,-95.37677,0.0,Accident on Almeda Rd at Ruth St.,US/Central,Day
A-431237,2,2017-04-16 15:09:57,2017-04-16 15:39:36,30.27942800000001,-97.723175,0.01,Accident on Martin Luther King Jr Blvd at Leona St.,US/Central,Day
A-4048376,2,2022-11-21 20:32:49,2022-11-22 03:32:48.000000000,30.091947,-97.679738,0.639,Accident,US/Central,Night
A-516417,3,2022-09-05 14:53:51,2022-09-05 15:38:22,29.608917,-97.875748,0.0,Two lanes blocked due to crash on I-10 Westbound at Exit 614 TX-130-TOLL.,US/Central,Day
A-6633875,2,2020-12-18 06:50:47,2020-12-18 08:15:36,32.810171999999994,-96.770163,0.064,Incident on GREENVILLE AVE near ROSS AVE Expect long delays.,US/Central,Night
A-7043309,3,2020-05-21 06:37:06,2020-05-21 06:52:06,30.163190000000004,-97.78811,0.4370000000000001,At Slaughter Ln/Exit 226 - Accident. on the right.,US/Central,Night
A-7185365,3,2020-04-19 12:04:08,2020-04-19 12:33:29,32.70997,-96.83015,0.144,At US-67/Exit 423 - Accident.,US/Central,Day
A-6828469,2,2020-12-20 12:59:00,2020-12-20 14:20:14,30.248053,-97.735422,0.384,Incident on S I-35 SB near N I-35 Drive with caution.,US/Central,Day
A-1859621,2,2019-10-02 07:55:59,2019-10-02 08:25:34,32.8218,-96.785767,0.0,Accident on Central Expy Northbound at Henderson Ave.,US/Central,Night
A-2181864,2,2019-04-22 14:50:22,2019-04-22 16:59:44,31.78668,-106.44352,0.0,Accident on Hueco Ave at Boone St.,US/Mountain,Day
A-1441714,3,2020-08-28 11:07:42,2020-08-28 11:53:32,29.568674,-95.168015,0.0,Two lanes blocked and right hand shoulder blocked due to accident on I-45 Gulf Fwy Southbound at FM-2351.,US/Central,Day
A-4162120,2,2022-06-01 17:54:26,2022-06-01 20:09:07,32.877716,-96.682998,0.092,Stationary traffic from I-635 W / Jupiter Rd to I-635 W due to accident.,US/Central,Day
A-4269944,2,2022-09-25 14:47:24,2022-09-25 20:47:23,30.321909,-97.695354,0.018,Accident,US/Central,Day
A-6425787,2,2021-02-22 16:14:35,2021-02-22 18:35:22,33.019157,-96.709256,2.905,Stationary traffic on US-75 S from US-75/Central Expy (North) (US-75 HOV) to US-75/Central Expy (South) (US-75 HOV) due to accident.,US/Central,Day
A-649588,2,2022-04-14 07:35:12,2022-04-14 08:37:07,30.34885,-97.555946,0.0,Crash on US-290 Northbound at Lexington St.,US/Central,Night
A-5876998,2,2021-10-21 16:19:16,2021-10-21 17:34:16,32.84059,-96.74378,0.073,Incident on E MOCKINGBIRD LN near ASHFORD DR Drive with caution.,US/Central,Day
A-2056038,2,2019-06-17 08:07:37,2019-06-17 08:46:47,29.40056,-98.461227,0.0,Accident on New Braunfels Ave at Drexel Ave.,US/Central,Day
A-520504,3,2022-08-31 17:23:15,2022-08-31 18:07:50,29.435873,-98.389839,0.0,One lane blocked due to crash on I-10 Eastbound at I-410 Exit 33 / I-10 Exit 581.,US/Central,Day
A-5732293,2,2021-09-08 08:54:00,2021-09-08 09:15:00.000000000,32.925998,-96.807982,0.706,Stationary traffic on LBJ Express from Preston Rd to Dallas North Tollway N due to accident.,US/Central,Day
A-2192889,3,2019-04-28 14:55:46,2019-04-28 15:54:15,29.768208,-95.455887,0.0,Right hand shoulder blocked and two lane blocked due to accident on I-610 Northbound before Memorial Dr.,US/Central,Day
A-1561453,2,2020-04-21 06:08:38,2020-04-21 06:53:45,32.851082,-96.77137,0.0,Accident on Central Expy at Lovers Ln.,US/Central,Night
A-7058330,3,2020-06-25 17:16:11,2020-06-25 17:34:14,32.870909999999995,-96.53052,0.428,At Dalrock Rd/Exit 64 - Accident. Left lane closed.,US/Central,Day
